{
  "contract_version": "1.3",
  "outline_scope": "batch",
  "chapter_offset": 3,
  "source_revision": "dangan-yujin-v2",
  "inherited": {
    "threads": ["TH-001"],
    "foreshadowing": ["FS-001", "FS-002"]
  },
  "source_trace": {
    "document": "示例_完整设定包（《档案余烬》）",
    "preserved": [
      "主冲突引擎：诉讼立案后的反制与档案代价兑现",
      "失败代价：永久退出行业并连累家人担保债务",
      "底线是不伪造证据、不拖前同事下水"
    ],
    "inferred": [
      "新增推导：第二批以「应诉 + 档案代价具体化」为单元循环",
      "新增推导：恒信内部出现向沈砚递话的裂缝"
    ]
  },
  "setting_refs": {
    "character_ids": [],
    "location_ids": [],
    "faction_ids": [],
    "rule_ids": [],
    "resource_ids": []
  },
  "genre_profile": {
    "primary": "urban",
    "secondary": [],
    "reader_promise": "主角每一次翻身都建立在可验证的代价上：用一份档案换一次准入，同时烧掉一段旧日信任。",
    "progression_axes": ["资源", "声誉", "关系"],
    "must_deliver": ["每次调用档案前先展示具体代价和对手反应", "解释规则时改变主角可行选择", "获得准入必然引来反制"],
    "avoid_moves": ["用整段行业史解释信用制度", "每章靠新档案碾压对手", "用「眼神一沉」代替策略推进"]
  },
  "story_threads": [
    {
      "id": "TH-001",
      "line_id": "L-001",
      "summary": "沈砚以档案残片为筹码，逐个换回市场准入并追查恒信封杀机制",
      "opened_chapter": "CH-0001",
      "planned_resolution_chapter": null,
      "status": "OPEN"
    }
  ],
  "direction_gate": {
    "premise": "被行业封杀的项目经理沈砚握着12份客户底档重返市场，但每调用一份，就有一份旧日信任被烧掉；诉讼立案后，档案代价开始落在具体的人身上。",
    "reader_promise": "主角每一次翻身都建立在可验证的代价上，不用巧合、不用运气、不用对手突然降智。",
    "pitch": "一个只肯用书面条款交换条件的落魄项目经理，在应诉和旧账反噬之间，把「不拖前同事下水」的底线一寸寸兑现成代价。",
    "opening_delivery": {
      "first_500": "恒信的律师函贴着项目交付节点送达，沈砚在应诉材料里发现：被约谈的第一位前同事，正是当年替他签字的那个人。",
      "first_3_chapters": [
        "应诉中争取到管辖异议，但披露义务悬在头上",
        "旧账反噬第一位前同事，档案代价具体化",
        "夏昭约见，摊牌前夜"
      ]
    },
    "assumptions": ["editorial_assumption：第二批以「应诉 + 代价具体化」为单元循环"]
  },
  "story_engine": {
    "theme_question": "靠掌握秘密重建信誉，代价是不是把所有人拉下水？",
    "protagonist": {
      "goal": "在应诉中守住档案来源，同时兑现不拖前同事下水的底线",
      "misbelief": "只要掌握足够多的秘密，就能保护所有人",
      "behavior": "越紧张越把信息拆成碎片，谈判先报条件再报代价",
      "line_in_the_sand": "不伪造证据，不把前同事拖下水"
    },
    "opponent": {
      "goal": "用披露义务撬开沈砚的档案来源，把旧账烧成公众事件",
      "resources": "诉讼资源、资本、行业舆论渠道",
      "plan": "以披露程序逼沈砚交出档案清单，再对名单上的人逐个施压",
      "escalation": "从管辖程序升级到对前同事的约谈，再升级到逼迫夏昭交出认责书"
    },
    "ending_proof": {
      "resolution_id": "RES-02",
      "claim": "沈砚用可验证的验收记录废墟重建信任，公开承认当年替恒信顶罪，接受旧同事可能恨自己的代价。",
      "choice": "在庭外公开承认顶罪换取夏昭证词，而不是把证据继续握在手里"
    },
    "escalation_ladder": [
      {
        "trigger": "诉讼立案并送达律师函",
        "choice": "以部分程序性文件换取管辖异议成立",
        "cost": "披露义务保留，档案来源仍暴露在程序风险下",
        "state_change": "应诉从被动答辩转为程序对抗",
        "axis_refs": ["声誉"]
      },
      {
        "trigger": "旧账反噬第一位前同事",
        "choice": "动用一份档案保住前同事，而非让他独自承担",
        "cost": "档案只剩10份，且调用路径被恒信记录",
        "state_change": "档案代价从抽象上限变成具体的人",
        "axis_refs": ["资源"]
      },
      {
        "trigger": "夏昭以认责书记录为条件约见",
        "choice": "承认顶罪换取证词，放弃秘密自保",
        "cost": "牵连旧同事并失去利用秘密的筹码",
        "state_change": "信誉重建从私下交易转向公开清算",
        "axis_refs": ["声誉", "关系"]
      }
    ]
  },
  "narrative_lines": [
    {"id": "L-001", "name": "信誉重建主线", "type": "main", "purpose": "沿「应诉反制 → 代价兑现 → 公开清算」逼近拿回恒信所占项目"},
    {"id": "L-002", "name": "夏昭关系线", "type": "relationship", "purpose": "沈砚需要她的证词，她需要他承认顶罪，隐藏不对称决定终局"}
  ],
  "volumes": [
    {
      "id": "V-02",
      "chapter_start": 4,
      "chapter_end": 5,
      "promise": "读者看到档案代价如何落到具体的人身上，而主角的底线开始值钱",
      "goal": "在应诉中守住档案来源，兑现不拖前同事下水的底线",
      "opposition": "恒信用披露程序和对前同事施压撬开档案",
      "choice": "动用一份档案保住前同事",
      "cost": "档案剩10份且调用路径被记录",
      "state_change": "档案代价具体化，夏昭摊牌条件浮出水面",
      "resolution_id": "RES-02",
      "anchors": {
        "quarter": "AN-V02-Q1",
        "midpoint": "AN-V02-MID",
        "three_quarter": "AN-V02-Q3",
        "ending": "AN-V02-END"
      }
    }
  ],
  "chapters": [
    {
      "id": "CH-0004",
      "volume_id": "V-02",
      "number": 4,
      "purpose": "应诉中争取管辖异议，同时发现旧账反噬第一位前同事",
      "reader_emotion": "程序性喘息里第一次感到代价落在别人身上",
      "emotion_source": "editorial_assumption",
      "rhythm_function": "批首加压",
      "narrative_line_ids": ["L-001", "L-002"],
      "line_weights": {"L-001": 0.6, "L-002": 0.4},
      "line_intersection": {"is_intersection": true, "line_ids": ["L-001", "L-002"], "reason": "披露义务同时威胁档案来源与夏昭的旁证身份"},
      "anchor_tags": ["AN-V02-Q1", "AN-V02-MID"],
      "axis_advance": [
        {"axis": "声誉", "change": "管辖异议成立，应诉从被动答辩转为程序对抗，合作方转为观望", "cost_paid": "披露义务保留，档案来源仍暴露在程序风险下", "evidence": "CH-0004#gocs[0].state_change"},
        {"axis": "资源", "change": "档案旧账反噬第一位前同事，代价从抽象上限变成具体的人", "cost_paid": "被约谈的前同事正是当年替沈砚签字的人"}
      ],
      "gocs": [
        {"goal": "在立案应诉中争取管辖异议", "obstacle": "恒信律师要求披露档案来源", "choice": "以部分程序性文件换取管辖异议成立", "state_change": "应诉从被动答辩转为程序对抗，披露义务保留"}
      ],
      "scene_effects": [
        {"scene_id": "V02-C04-S01", "reader_reaction": "松半口气又攥紧", "reader_question": "被约谈的前同事会不会先一步扛不住"}
      ],
      "foreshadowing_ops": [
        {"id": "FS-001", "action": "advance", "summary": "夏昭以认责书记录为条件约见沈砚"},
        {"id": "FS-003", "action": "plant", "summary": "恒信内部有人绕过流程向沈砚递话"}
      ],
      "state_delta": {
        "entry_state": ["沈砚重新获得一家合作方", "处理诉讼对家人担保债务的牵连", "档案旧账波及旧同事的后果"],
        "trigger": "恒信律师函要求披露档案来源",
        "choice": "以部分程序性文件换取管辖异议成立",
        "cost": "披露义务保留，档案来源暴露在程序风险下",
        "changed_state": ["管辖异议成立，应诉转入程序对抗", "第一位前同事被约谈"],
        "new_obligations": ["决定是否动用档案保住前同事"],
        "unresolved_pull": "递话的恒信内部人是谁"
      },
      "thread_ops": [{"id": "TH-001", "action": "advance", "effect": "应诉反制与档案代价具体化同时推进"}],
      "continue_reason": "管辖异议只是喘息，披露义务和被约谈的前同事把下一步逼到眼前"
    },
    {
      "id": "CH-0005",
      "volume_id": "V-02",
      "number": 5,
      "purpose": "动用一份档案保住前同事，夏昭摊牌条件浮出水面",
      "reader_emotion": "底线兑现的沉重感与摊牌前夜的紧绷",
      "emotion_source": "editorial_assumption",
      "rhythm_function": "批末收束加压",
      "narrative_line_ids": ["L-001", "L-002"],
      "line_weights": {"L-001": 0.5, "L-002": 0.5},
      "line_intersection": {"is_intersection": true, "line_ids": ["L-001", "L-002"], "reason": "保住前同事的档案调用与夏昭的认责书条件在同一张桌上对齐"},
      "anchor_tags": ["AN-V02-Q3", "AN-V02-END"],
      "axis_advance": [
        {"axis": "资源", "change": "动用一份档案保住前同事，档案剩10份且调用路径被恒信记录", "cost_paid": "档案筹码净减一份，调用路径暴露", "evidence": "CH-0005#gocs[0].state_change"},
        {"axis": "关系", "change": "夏昭的摊牌条件显性化：认责书换证词", "cost_paid": "沈砚必须在下批见面时给出答复"}
      ],
      "gocs": [
        {"goal": "兑现不拖前同事下水的底线", "obstacle": "前同事独自承担约谈压力，恒信记录在案", "choice": "动用一份档案保住前同事", "state_change": "档案剩10份且调用路径被恒信记录"}
      ],
      "scene_effects": [
        {"scene_id": "V02-C05-S01", "reader_reaction": "底线兑现的刺痛", "reader_question": "夏昭的认责书条件会不会就是压垮秘密自保的最后一根稻草"}
      ],
      "foreshadowing_ops": [
        {"id": "FS-002", "action": "advance", "summary": "档案代价上限逼近：剩10份，调用路径已被记录"},
        {"id": "FS-003", "action": "advance", "summary": "递话人暗示恒信内部对封杀机制有分歧"}
      ],
      "state_delta": {
        "entry_state": ["管辖异议成立，应诉转入程序对抗", "第一位前同事被约谈", "决定是否动用档案保住前同事"],
        "trigger": "前同事在约谈压力下动摇",
        "choice": "动用一份档案保住前同事",
        "cost": "档案剩10份，调用路径被恒信记录",
        "changed_state": ["前同事解除约谈压力", "夏昭摊牌条件浮出水面"],
        "new_obligations": ["在下批与夏昭的见面中答复认责书条件"],
        "unresolved_pull": "恒信内部分歧会不会成为反制通道"
      },
      "thread_ops": [{"id": "TH-001", "action": "advance", "effect": "底线兑现使信誉与档案进一步脱钩，摊牌条件上桌"}],
      "continue_reason": "档案剩10份且路径被记录，夏昭的认责书条件把下一批逼向公开清算"
    }
  ],
  "foreshadowing": [
    {
      "id": "FS-001",
      "summary": "夏昭持有沈砚当年签认责书的会议记录，双方互相不知道对方手里的牌",
      "type": "关系信息",
      "importance": "P0",
      "plant_chapter": "CH-0001",
      "planned_harvest": null,
      "harvest_effect": "逼沈砚在庭外公开承认顶罪，重新定义他和夏昭的关系",
      "status": "ADVANCE"
    },
    {
      "id": "FS-002",
      "summary": "档案调用代价的上限没有明确，每用一份信任就烧掉一段",
      "type": "规则边界",
      "importance": "P1",
      "plant_chapter": "CH-0001",
      "planned_harvest": null,
      "harvest_effect": "在终局明确主角不能再靠档案自保",
      "status": "ADVANCE"
    },
    {
      "id": "FS-003",
      "summary": "恒信内部有人绕过流程向沈砚递话，封杀机制内部有分歧",
      "type": "信息",
      "importance": "P1",
      "plant_chapter": "CH-0004",
      "planned_harvest": null,
      "harvest_effect": "成为沈砚从内部撬开封杀机制的通道",
      "status": "ADVANCE"
    }
  ],
  "entity_ledger": {
    "entities": [
      {
        "id": "ENT-001",
        "name": "客户底档",
        "type": "item",
        "critical_facts": [
          {"chapter": 4, "fact": "档案剩11份，其中一份的旧账反噬第一位前同事", "status": "active"},
          {"chapter": 5, "fact": "为保前同事动用1份，档案剩10份且调用路径被记录", "status": "changed"}
        ]
      }
    ]
  },
  "branch_nodes": [],
  "open_decisions": [
    {
      "question": "恒信内部递话人的立场是否可信？",
      "blocks": "反制通道的成立与否",
      "owner": "作者"
    }
  ]
}
